[
  {
    "id": "aitoc",
    "title": "AI-to-Consumer business models",
    "status": "active",
    "layout": "legacy",
    "created_date": "2026-06-09",
    "main_question": "Can AI-to-C products become durable standalone businesses, or do they need large-company subsidy, bundled distribution, or non-consumer revenue to survive?",
    "scope_in": [
      "Consumer-facing AI assistants, companions, productivity, search, creative, education, and personal-agent products",
      "Products sold directly to individuals, even when owned by large B2B or platform companies",
      "Hybrid products where consumer adoption supports enterprise, ads, APIs, hardware, or ecosystem retention"
    ],
    "scope_out": [
      "Pure enterprise AI agents with no direct consumer product",
      "Infrastructure-only model providers unless their consumer product affects the business model",
      "Technical model benchmarking without business-model relevance"
    ],
    "search_queries": {
      "daily": [
        "AI app paid tier",
        "AI assistant pricing change",
        "consumer AI subscription",
        "AI app usage limits",
        "AI search ads",
        "AI companion app revenue",
        "AI app free tier limit",
        "AI agent consumer subscription",
        "AI app store ranking",
        "AI product shuts down consumer"
      ],
      "weekly": [
        "consumer AI business model",
        "AI app monetization",
        "AI subscription retention",
        "AI app revenue estimate",
        "AI assistant paid plan",
        "AI model cost pricing consumer app",
        "AI marketplace revenue share",
        "AI bundled subscription"
      ],
      "regional": [
        "China AI assistant paid plan",
        "Doubao subscription",
        "consumer AI app China monetization",
        "AI assistant India pricing",
        "AI companion Japan subscription",
        "EU AI assistant subscription privacy"
      ]
    },
    "claim_types": [],
    "freshness_overrides": {},
    "hypothesis_ids": [
      "H1",
      "H2",
      "H3",
      "H4",
      "H5"
    ]
  },
  {
    "id": "sea-shopee-ai",
    "title": "SEA's AI initiatives, especially Shopee and agentic commerce direction",
    "status": "active",
    "layout": "scoped",
    "created_date": "2026-07-14",
    "main_question": "Is SEA building a durable, owned AI/agentic-commerce advantage for Shopee, or is its agentic-commerce direction dependent on external AI platforms (OpenAI, Google)?",
    "scope_in": [
      "Sea Limited AI across Shopee, Monee, and Garena",
      "Agentic commerce: AI product discovery and purchase completion",
      "Seller-side AI tooling and ShopeeVIP AI bundling",
      "SEA in-house AI capability (AI CoE, Codex)"
    ],
    "scope_out": [
      "Non-SEA SEA-region AI efforts except as competitive comparison",
      "Model-provider infrastructure economics unless they change Shopee's position"
    ],
    "search_queries": {
      "daily": [
        "Shopee AI",
        "Sea Limited AI",
        "Shopee agentic commerce",
        "Shopee ChatGPT",
        "Shopee AI shopping assistant"
      ],
      "weekly": [
        "Sea Limited OpenAI partnership",
        "Google Sea agentic shopping Shopee",
        "Shopee AI monetization sellers",
        "Southeast Asia agentic commerce"
      ],
      "regional": [
        "Shopee AI Indonesia",
        "Shopee AI Vietnam",
        "Lazada AI agent Southeast Asia",
        "Shopee Brazil AI ChatGPT"
      ]
    },
    "claim_types": [],
    "freshness_overrides": {},
    "hypothesis_ids": [
      "H1",
      "H2",
      "H3"
    ]
  }
]
